{"classification":"SYNTHETIC","dimensions":["project","period"],"grain":"project_month","id":"housing-data","indicators":[{"id":"DEMO-A-stock","methodology":"Saldo de cohorte al final del mes.","name":"Stock al cierre","period":"2026-09-01","unit":"unidades","value":67},{"id":"DEMO-A-velocity","methodology":"Media aritmética de tres meses completos.","name":"Ritmo reciente","period":"2026-09-01","unit":"unidades/mes","value":3.3333333333333335},{"id":"DEMO-A-sales","methodology":"Ventas del último mes completo.","name":"Ventas del último mes","period":"2026-09-01","unit":"unidades","value":3},{"id":"DEMO-B-stock","methodology":"Saldo de cohorte al final del mes.","name":"Stock al cierre","period":"2026-09-01","unit":"unidades","value":64},{"id":"DEMO-B-velocity","methodology":"Media aritmética de tres meses completos.","name":"Ritmo reciente","period":"2026-09-01","unit":"unidades/mes","value":7.666666666666667},{"id":"DEMO-B-sales","methodology":"Ventas del último mes completo.","name":"Ventas del último mes","period":"2026-09-01","unit":"unidades","value":8}],"kind":"data","label":"DEMO / SYNTHETIC DATA","metrics":["stock_open","sales","stock_close"],"provenance":{"as_of":"2026-10-01","dataset_sha256":"056f0d8331eeb8a3751c03063740f248a4942c7a21fc54e10b4b77fce27bf2ed","generated_at":"2026-10-09T18:00:00Z","limitations":["Datos inventados exclusivamente para demostración.","Sin reposiciones, anulaciones intermedias ni cambios de universo."],"semantics":"SYNTHETIC_DEMO","source":"Authored deterministic fixture housing-v1","transformation":"Meses completos; cohorte fija; media móvil de tres meses limitada por stock."},"quality":{"checks":["Grano único","Meses consecutivos completos","Stock conciliado","Sin unidades pendientes de revisión"],"freshness":"Corte 2026-10-01; no implica actualización en tiempo real.","status":"PASS"},"question":"¿Tener menos stock significa que estamos vendiendo mejor?","rows":[{"period":"2026-01-01","project":"DEMO-A","review_units":0,"sales":8,"stock_close":112,"stock_open":120},{"period":"2026-02-01","project":"DEMO-A","review_units":0,"sales":9,"stock_close":103,"stock_open":112},{"period":"2026-03-01","project":"DEMO-A","review_units":0,"sales":7,"stock_close":96,"stock_open":103},{"period":"2026-04-01","project":"DEMO-A","review_units":0,"sales":8,"stock_close":88,"stock_open":96},{"period":"2026-05-01","project":"DEMO-A","review_units":0,"sales":6,"stock_close":82,"stock_open":88},{"period":"2026-06-01","project":"DEMO-A","review_units":0,"sales":5,"stock_close":77,"stock_open":82},{"period":"2026-07-01","project":"DEMO-A","review_units":0,"sales":4,"stock_close":73,"stock_open":77},{"period":"2026-08-01","project":"DEMO-A","review_units":0,"sales":3,"stock_close":70,"stock_open":73},{"period":"2026-09-01","project":"DEMO-A","review_units":0,"sales":3,"stock_close":67,"stock_open":70},{"period":"2026-01-01","project":"DEMO-B","review_units":0,"sales":4,"stock_close":116,"stock_open":120},{"period":"2026-02-01","project":"DEMO-B","review_units":0,"sales":5,"stock_close":111,"stock_open":116},{"period":"2026-03-01","project":"DEMO-B","review_units":0,"sales":5,"stock_close":106,"stock_open":111},{"period":"2026-04-01","project":"DEMO-B","review_units":0,"sales":6,"stock_close":100,"stock_open":106},{"period":"2026-05-01","project":"DEMO-B","review_units":0,"sales":6,"stock_close":94,"stock_open":100},{"period":"2026-06-01","project":"DEMO-B","review_units":0,"sales":7,"stock_close":87,"stock_open":94},{"period":"2026-07-01","project":"DEMO-B","review_units":0,"sales":7,"stock_close":80,"stock_open":87},{"period":"2026-08-01","project":"DEMO-B","review_units":0,"sales":8,"stock_close":72,"stock_open":80},{"period":"2026-09-01","project":"DEMO-B","review_units":0,"sales":8,"stock_close":64,"stock_open":72}],"schema_version":"1.0.0","version":"1.0.0"}
